fund,category,proposal,yes,no,votes_cast,requested amount,status,overall_score
Fund10,SPO Tools & Community Projects,Pop up Cafe - A place for the community to meet the community.,6079739,41322525,153,12000,NOT FUNDED,2.91
Fund10,SPO Tools & Community Projects,Empowering Collaborative Stake Pools with Automated Reward Distribution,65766912,101864360,238,14608,NOT FUNDED,4.5
Fund10,SPO Tools & Community Projects,"Wieczorowa Pora - Spaces, podcasts & YT focused on Cardano Community & SPOs",10598178,51517767,150,9600,NOT FUNDED,4.06
Fund10,SPO Tools & Community Projects,Turbo Powered Dubai Cardano Community Social Meet Ups ,3542650,47298583,175,9840,NOT FUNDED,2.58
Fund10,SPO Tools & Community Projects,"Public list of SPO groups (json,csv)",61934775,106447009,174,44000,NOT FUNDED,3.6
Fund10,SPO Tools & Community Projects,"Pre-Summit Dubai ""I'm On A Boat"" Memorable Event",5618332,54475195,169,15000,NOT FUNDED,3.66
Fund10,SPO Tools & Community Projects,Cardano SPO Club for non-English speaker,66207924,119964340,249,32936.4,NOT FUNDED,3.85
Fund10,SPO Tools & Community Projects,Easy onboarding of ADA holders to SPOs,64754311,120636720,249,56400,NOT FUNDED,4.41
Fund10,SPO Tools & Community Projects,Stakepool Uptime Monitoring and Health-Check Portal,52387727,108494043,279,99600,NOT FUNDED,4.16
Fund10,SPO Tools & Community Projects,Facilitating SPO Travel & Media Production at High Value Blockchain Events Worldwide,31615432,89541507,251,350000,NOT FUNDED,4
Fund10,SPO Tools & Community Projects,Cardano Node Management Tool,40517652,102496560,181,59840,NOT FUNDED,3.88
Fund10,SPO Tools & Community Projects,"HAZELnet.io - Social Connectivity for Stakepool Operators, Delegators and Communities",48965172,115384641,204,62000,NOT FUNDED,4.02
Fund10,SPO Tools & Community Projects,SPOUSE: Open and Self-hosted SPO Security Evaluation Tool,38709139,108704052,213,74715.6,NOT FUNDED,4.04
Fund10,SPO Tools & Community Projects,Cardano Vietnam SPO Association,57510922,127687726,252,38987.2,NOT FUNDED,4.05
Fund10,SPO Tools & Community Projects,45B - SPO Spotter - Delegation suggester based on Open Source interchangeable algorithms to rank Stake Pools,39270614,110907906,180,20520,NOT FUNDED,4.4
Fund10,SPO Tools & Community Projects,Cardano Xcard - Digital Business Card exclusively for Cardano Fans,44484830,116725910,194,38800,NOT FUNDED,3.01
Fund10,SPO Tools & Community Projects,Community Education Initiative: Strengthening Cardano Through Knowledge,42505912,124705411,215,45200,NOT FUNDED,3.89
Fund10,SPO Tools & Community Projects,SPOs awareness and education in the French-speaking community of Cardano with Edustake,25916217,109115096,168,17808.8,NOT FUNDED,4.36
Fund10,SPO Tools & Community Projects,Asia Stakepool Alliance,28700463,111911220,185,46400,NOT FUNDED,3.92
Fund10,SPO Tools & Community Projects,Impact SPOs - Accountable and Verified!,39470964,122703724,188,57920,NOT FUNDED,4.28
Fund10,SPO Tools & Community Projects,Basic smart contracts for SPO campaigns and events (1-click deployment and open-source),17024176,103167602,150,21648,NOT FUNDED,4.23
Fund10,SPO Tools & Community Projects,Community outreach program on Cardano blockchain technology education in Nigeria,35488661,121659640,156,30000,NOT FUNDED,3.47
Fund10,SPO Tools & Community Projects,Africa Stakepool Academy | Securing The Network,31881299,118437755,219,104000,NOT FUNDED,4.36
Fund10,SPO Tools & Community Projects,Cardano Guide - A one-stop guide,30442770,119218126,173,27282.8,NOT FUNDED,3.26
Fund10,SPO Tools & Community Projects,"Central Information Hub with Crowdsourced Onboarding and Education, with an Open-Source Robust Freelance Platform designed for SPO community engagement.",33861901,122788890,172,132000,NOT FUNDED,3.6
Fund10,SPO Tools & Community Projects,Risk Monitor for SPOs,33548550,124131704,221,111834.4,NOT FUNDED,4.24
Fund10,SPO Tools & Community Projects,Auto Stake Pool Setup - Pocket Pool,29624284,120374952,233,40000,NOT FUNDED,3.63
Fund10,SPO Tools & Community Projects,Cardano Over Coffee - Brewing Success for the Cardano Community by Empowering SPOs and Builders,43627831,136460992,334,133333.2,NOT FUNDED,4.4
Fund10,SPO Tools & Community Projects,SPO 4 Life,20177547,113416286,186,25208,NOT FUNDED,4.05
Fund10,SPO Tools & Community Projects,"SPOs Spanish Community - Workshops, Webinars, Events and Networking, fostering the development and evolution of the ecosystem with personalized support and education to operators and developers.",22922750,117060704,181,60000,NOT FUNDED,3.57
Fund10,SPO Tools & Community Projects,Subbit.xyz : Featherweight channels for pay-as-you-go subscriptions & first plugin with Dandelion.,24825921,119115853,180,97000,NOT FUNDED,4.04
Fund10,SPO Tools & Community Projects,SPO Online Business Academy,44010330,139352505,250,111472.8,NOT FUNDED,4.6
Fund10,SPO Tools & Community Projects,Delegate polling and voting mechanisms for SPOs,18909459,117147962,189,20328,NOT FUNDED,4.16
Fund10,SPO Tools & Community Projects,SPOPatrons.io - A SPO Patrons Management Portal,18340141,117525950,163,25158.4,NOT FUNDED,4.4
Fund10,SPO Tools & Community Projects,AdaLink: Affiliate Network for SPO Growth,38012463,137431499,257,96000,NOT FUNDED,4
Fund10,SPO Tools & Community Projects,ALDEA NFT Marketplace V2,26973187,126470033,209,84000,NOT FUNDED,4.17
Fund10,SPO Tools & Community Projects,"ISPO Center - Aggregator, reviews, tech & marketing support in running ISPOs",17076779,116979269,153,59066.8,NOT FUNDED,3.99
Fund10,SPO Tools & Community Projects,Enabling Caribbean Creativity: Building the Creator Economy with Cardano,15820471,116843090,169,20000,NOT FUNDED,4.14
Fund10,SPO Tools & Community Projects,Impact Measurement of SPOs,14233116,115486769,170,30000,NOT FUNDED,3.69
Fund10,SPO Tools & Community Projects,CatalystCon 2023 | SPO Spotlight,15058851,116639881,167,33600,NOT FUNDED,4.19
Fund10,SPO Tools & Community Projects,TADAStake - A Distribution Platform,7334120,108938081,152,29200,NOT FUNDED,3.92
Fund10,SPO Tools & Community Projects,Cardano Network Mixers: Bridging SPOs with High Net Worth Entrepreneurs,15648162,118379463,172,56000,NOT FUNDED,4.23
Fund10,SPO Tools & Community Projects,Cardano Stake Pool Owner Behavior - Academic Research,23671572,126753035,202,20000,NOT FUNDED,4.06
Fund10,SPO Tools & Community Projects,SPO Interview Channel - SPO's Voice Need To Be Heard,11827309,115547226,152,24000,NOT FUNDED,3.88
Fund10,SPO Tools & Community Projects,MAV100: Opening access of the Cardano Blockchain to students through our Stake Pool Incubator Program.,20387630,124735130,186,116000,NOT FUNDED,3.97
Fund10,SPO Tools & Community Projects,"Harmonie NFT Galerie: Physical Gallery & Digital Signage Solutions in Shopping Malls for Cardano NFTs: artists, advertisements, and more",14736716,119381372,157,30000,NOT FUNDED,3.88
Fund10,SPO Tools & Community Projects,cardaSCAN.io - A community-funded stake pool vulnerability scanning service,43676258,149181812,277,270500,NOT FUNDED,4.44
Fund10,SPO Tools & Community Projects,"Unistake - Open Source Staking Subscription Model: Empowering Community through Decentralized Monetization""",52711574,158541961,237,396000,NOT FUNDED,2.8
Fund10,SPO Tools & Community Projects,KALYX.IO - The Leveraged dCFD Contracts Platform on Cardano,14271536,120995811,154,30000,NOT FUNDED,4.25
Fund10,SPO Tools & Community Projects,"Cardano's Exhibition at 6 Blockchain Events in 6 Countries in Latin America powered by Community - Brazil, Argentina, Mexico, Colombia, Venezuela and Uruguay - LATAM",16552032,126826253,268,159042.8,NOT FUNDED,3.92
Fund10,SPO Tools & Community Projects,SPO - Pool Backup and Disaster Recovery,13651461,124213548,196,140000,NOT FUNDED,3.52
Fund10,SPO Tools & Community Projects,Fund Raising With SPO Model Platform for Artist (And Anyone),13838998,125034417,177,94566.8,NOT FUNDED,3.83
Fund10,SPO Tools & Community Projects,Cardano Lounge by BrazilPool - A Cardano Dedicated Coworking and Events Venue in So Paulo,12433572,127669602,172,85398,NOT FUNDED,3.3
Fund10,SPO Tools & Community Projects,"The path to minting more blocks in Africa, For a more resilient Cardano protocol.",35079054,150333816,258,160000,NOT FUNDED,3.9
Fund10,SPO Tools & Community Projects,Africa Stakepool Alliance,20991250,139685451,221,46400,NOT FUNDED,4.09
Fund10,SPO Tools & Community Projects,Delegation gate (login) for popular web frameworks,9082271,136667459,163,98000,NOT FUNDED,3.22
Fund10,SPO Tools & Community Projects,Development in pavia_io metaverse / 3D animation lets FURTHER blurr the lines of the METAverse and reality. we are continually pushing the boundries of what can and cannot be done! while working every job i can find to pay for progress.,15721453,144776778,171,19200,NOT FUNDED,3.36
Fund10,SPO Tools & Community Projects,Delegator loyalty contract at stakepool reward address,10149108,140578069,166,70000,NOT FUNDED,3.26
Fund10,SPO Tools & Community Projects,SPO Relay Node Security - Vulnerability Assessment of Relay Node Security,31432766,179432645,297,418181.6,NOT FUNDED,3.42
Fund10,SPO Tools & Community Projects,"SAPA' no more - educating Nigerian creatives about SPO and Project Catalyst through web3 accelerator and music festival in Lagos, Nigeria.",13119954,164208149,211,200000,NOT FUNDED,3.24
Fund10,Developer Ecosystem - The Evolu,Provide multiple templates on how to write apps and games for the Cardano ecosystem using Paima,490867175,123057958,770,180000,FUNDED,3.44
Fund10,Developer Ecosystem - The Evolu,MLabs - Cardano-Transaction-Library Evolution,400791352,34358984,470,90476,FUNDED,4.32
Fund10,Developer Ecosystem - The Evolu,MLabs - Cardano Onchain Languages Benchmark,404067155,42300919,447,108572,FUNDED,4.06
Fund10,Developer Ecosystem - The Evolu,"MLabs - LambdaBuffers (was Cardano dApp schemas) code generation backends for Rust, Javascript and Aiken",369210816,14205691,411,104228.4,FUNDED,4.37
Fund10,Developer Ecosystem - The Evolu,MLabs - Browser-based Wallet for Developers & Testers,336002052,28714072,380,100428,FUNDED,4.09
Fund10,Developer Ecosystem - The Evolu,MLabs - Cardano Game Engine Wallet - Godot Integration,350790306,54029377,439,218952,FUNDED,4.37
Fund10,Developer Ecosystem - The Evolu,Scrolls - Develop and deploy Custom GraphQL chain indexes,239860607,8329911,452,83142.8,FUNDED,4.71
Fund10,Developer Ecosystem - The Evolu,"Crypto magazine published by Japanese polular Publisher ""Futaba-Sha""",437061473,213078345,670,100000,FUNDED,4.48
Fund10,Developer Ecosystem - The Evolu,"Exhibit Largest Blockchain EXPO(JP): Cardano is hardly recognized in Japan. Therefore, we will exhibit at one of the largest trade shows to raise awareness and encourage developers to enter the market. ",335505180,112944002,487,106809.6,FUNDED,4.29
Fund10,Developer Ecosystem - The Evolu,Marlowe Runtime SDKs,346771258,125925245,475,61714.4,FUNDED,4.43
Fund10,Developer Ecosystem - The Evolu,Plug-and-play Smart Contract API: a game-changing platform to deploy open-source contracts instantly,245215169,38263236,355,76266.4,FUNDED,4.27
Fund10,Developer Ecosystem - The Evolu,Marlowe - Decentralized Oracle Integration,325020946,125273978,533,94285.6,FUNDED,4.6
Fund10,Developer Ecosystem - The Evolu,Anastasia Labs - Open Source Production Grade DApps,240476908,42107522,293,54200,FUNDED,3.44
Fund10,Developer Ecosystem - The Evolu,"Sorbet Wallet Debugger, by Sundae Labs",273088591,87071953,412,80000,FUNDED,4.4
Fund10,Developer Ecosystem - The Evolu,Winter Protocol: Open-Source Traceability & Real World Asset Tokenization,286610888,108672373,531,80000,FUNDED,4.7
Fund10,Developer Ecosystem - The Evolu,Onboard Japanese Big IP holders onto Cardano space and Build an IP Certification system on the Cardano blockchain,286117565,126929427,451,116516,FUNDED,4.22
Fund10,Developer Ecosystem - The Evolu,Spectrum Network | Security Audit,239235314,110125300,556,204058,FUNDED,4.19
Fund10,Developer Ecosystem - The Evolu,Spectrum Network | Testing Protocol at Scale,222471068,101753625,478,113457.6,FUNDED,4.12
Fund10,Developer Ecosystem - The Evolu,Help NMKR to continue operations & develop NFT Infrastructure,214584884,127643195,465,240000,FUNDED,4.5
Fund10,Developer Ecosystem - The Evolu,Fixing Nintendo's Problem: Unlocking a Multi-million Dollar NFC/NFT Authentication Market for the Cardano Ecosystem with Open-Source [Cardano Warriors + dcSpark],207895725,128727408,449,194838,FUNDED,4.77
Fund10,Developer Ecosystem - The Evolu,OpShin Core - Developing Python Smart Contracts,174367443,95418103,414,17280,FUNDED,4.29
Fund10,Developer Ecosystem - The Evolu,Socious: Decentralized Escrow and Dispute Resolution,193104576,118721369,427,138285.6,NOT FUNDED,4.42
Fund10,Developer Ecosystem - The Evolu,plu-ts Typescript smart-contracts - road to production,199065022,130756619,442,226756,NOT FUNDED,3.5
Fund10,Developer Ecosystem - The Evolu,Open-Source Blockfrost Deployment Images,126161820,58314600,172,49200,FUNDED,4.25
Fund10,Developer Ecosystem - The Evolu,Blockfrost multi-provider transaction submit plugin,168835719,101967976,347,64000,NOT FUNDED,4.53
Fund10,Developer Ecosystem - The Evolu,Staking Basket Bot - Incentivizing Cardano's Decentralization,103219756,44651456,214,90000,NOT FUNDED,3.8
Fund10,Developer Ecosystem - The Evolu,Introducing Cardano Laboratory: A Development and Testing Environment for Cardano,176701719,119133087,426,159200,NOT FUNDED,3.89
Fund10,Developer Ecosystem - The Evolu,Stoa Smart Contract - User Account NFTs,94366912,64060243,190,89600,NOT FUNDED,3.59
Fund10,Developer Ecosystem - The Evolu,Development of a Cardano DApp and extensive documentation of each step along the way,77072415,53259434,148,8000,FUNDED,1.89
Fund10,Developer Ecosystem - The Evolu,Profile & Project Account NFTs,94990422,75615078,198,117200,NOT FUNDED,3.24
Fund10,Developer Ecosystem - The Evolu,Watch Wallet for Cardano,76297910,61494528,141,17113.6,NOT FUNDED,3.67
Fund10,Developer Ecosystem - The Evolu,Socious: Extended Quadratic Funding for Open Source Projects,158612037,144395242,384,198514.4,NOT FUNDED,4.19
Fund10,Developer Ecosystem - The Evolu,Finalize Helios,111811611,104355986,324,166440,NOT FUNDED,3.93
Fund10,Developer Ecosystem - The Evolu,Mesh: Support Teams Building Cardano dApps with MESH JS SDK (A comprehensive open-source SDK for building dApps on Cardano),103753208,96309996,231,60000,NOT FUNDED,4.39
Fund10,Developer Ecosystem - The Evolu,Cardano Kubernetes Orchestra: A decentralized end-to-end blockchain indexer API for Cardano,119673189,115456096,311,63066.4,NOT FUNDED,4.67
Fund10,Developer Ecosystem - The Evolu,Build on Maestro - Grants to sponsor projects building exciting products on Maestro's dApp platform,93390595,103997102,249,68666.4,NOT FUNDED,4.28
Fund10,Developer Ecosystem - The Evolu,Wolfram Blockchain Integration Framework - Enabling Simultaneous Access to Blockchain Ecosystems,121180306,132659398,354,232360,NOT FUNDED,4.58
Fund10,Developer Ecosystem - The Evolu,Project-Based Documentation for the Open-Source Andamio Platform,104045769,134850996,193,127614.4,NOT FUNDED,4.17
Fund10,Developer Ecosystem - The Evolu,Threshold Signatures for Cardano Wallets,59143638,93494149,196,21912,NOT FUNDED,3.87
Fund10,Developer Ecosystem - The Evolu,Cardano Events in Ukraine 20 cities - with the goal to invite more devs to the ecosystem,9113367,49921583,169,44440,NOT FUNDED,3.32
Fund10,Developer Ecosystem - The Evolu,Cardano Smart Contracts with Helios (2nd Edition),55161233,97542020,176,14400,NOT FUNDED,3.9
Fund10,Developer Ecosystem - The Evolu,A complete end-to-end example for dApp development with Lucid + Aiken,62240786,105718956,163,28000,NOT FUNDED,3.42
Fund10,Developer Ecosystem - The Evolu,"Translation, localization and implementation of the Gimbalabs' Plutus Project-based learning program.",66988616,112584311,221,136236,NOT FUNDED,4.37
Fund10,Developer Ecosystem - The Evolu," DAOGEN.ai: Building Open-Source AI Agent Infrastructure, Stimulating New Methods of Developer and General Education ",80637139,128251874,232,92757.6,NOT FUNDED,4.73
Fund10,Developer Ecosystem - The Evolu,Make NFTCDN Free To Use,101864108,154329867,348,279600,NOT FUNDED,4.63
Fund10,Developer Ecosystem - The Evolu,NuNet: Decentralized GPU Splitting on software level // Splitting large scale compute work into small containers optimized for deployment on decentralized hardware is a necessary component of any decentralized system.,77394592,132250558,376,147760,NOT FUNDED,4.44
Fund10,Developer Ecosystem - The Evolu,Advancing Community Governance Tooling on Andamio,73273738,128815812,179,43760,NOT FUNDED,4.69
Fund10,Developer Ecosystem - The Evolu,"MLabs x FluxusNetwork, risk mitigation for investments for Cardano projects",85783172,143627804,224,164800,NOT FUNDED,2.47
Fund10,Developer Ecosystem - The Evolu,Advancing Plutus PBL and Cultivating African Youth Skills through Wada Hubs,77225836,141874716,234,168000,NOT FUNDED,4.27
Fund10,Developer Ecosystem - The Evolu,Online Training Platform for Developers and Freelancers on Cardano,63879167,128633885,227,78365.2,NOT FUNDED,3.8
Fund10,Developer Ecosystem - The Evolu,eUTxO Fundamentals: Building Cardano Smart Contracts [eBook],48672193,114132530,218,38000,NOT FUNDED,4.32
Fund10,Developer Ecosystem - The Evolu,Graphic Tx Builder and Viewer,36399951,102262801,149,36000,NOT FUNDED,4.09
Fund10,Developer Ecosystem - The Evolu,"[C2VN]: ""Together Learning Haskell/Plutus in native language"" Club",68923112,139145441,225,18592,NOT FUNDED,3.84
Fund10,Developer Ecosystem - The Evolu,Nurturing Roots in Africa: The Evolution (Education),76047498,147801191,254,180000,NOT FUNDED,3.69
Fund10,Developer Ecosystem - The Evolu,Onboarding Python developers to Cardano,40724356,119861270,184,19142.8,NOT FUNDED,4.28
Fund10,Developer Ecosystem - The Evolu,Wada Ghana Resource Center. Empowering African Youth in Web3 and Cardano Blockchain Development.,64634415,143817045,216,165180,NOT FUNDED,4.17
Fund10,Developer Ecosystem - The Evolu,"NuNet: Decentralized GPU Clusters - Research & PoC // Massive GPU computing power is scattered across gamers, miners and individual computer users; Proposal includes research and building a PoC for combining these resources into virtual GPU clusters.",58593652,138081369,311,123000,NOT FUNDED,4.07
Fund10,Developer Ecosystem - The Evolu,Automation and Scaling of current funded Catalyst Developer Mentorship Program using Andamio learning management system and Cardano Blockchain capabilities,52373456,131910314,161,97808,NOT FUNDED,3.99
Fund10,Developer Ecosystem - The Evolu,"Open-Source Wallet Link for Cardano, Ethereum, Polygon, and other blockchains: Enabling Cross-Chain Rewards and Interaction",24814918,104444366,193,21600,NOT FUNDED,4.56
Fund10,Developer Ecosystem - The Evolu,Python Based Open Source Permissionless Marketplace and Documentation,23651805,106943759,161,50000,NOT FUNDED,3.84
Fund10,Developer Ecosystem - The Evolu,Open Source Python Tool for Linkage Finance Smart Contract Interaction,41000409,125206684,209,8400,NOT FUNDED,3.37
Fund10,Developer Ecosystem - The Evolu,Cyber security & Cardano. Collaboration between a world leader in cyber security and the Cardano ecosystem. This collaboration will be essential to be able to offer Cardano technology to international corporations.,46151391,132434658,160,35000,NOT FUNDED,4.27
Fund10,Developer Ecosystem - The Evolu,Gimbalabs Plutus Project-Based Learning: Student Contributor Treasury,26866290,113615101,195,10000,NOT FUNDED,4.21
Fund10,Developer Ecosystem - The Evolu,"Web3 NFT Tokengated for eCommerces, Sites, Landing Pages & Conversion Pages - Bringing eCommerce to the Cardano blockchain",53395600,142203722,269,97857.2,NOT FUNDED,3.79
Fund10,Developer Ecosystem - The Evolu,Project Community Verification - NFTPass,24920672,114114154,138,29568,NOT FUNDED,3.8
Fund10,Developer Ecosystem - The Evolu,Hydra as a B2B layer for DeFi- a white paper and a MVP,45720637,136987448,270,109600,NOT FUNDED,4.02
Fund10,Developer Ecosystem - The Evolu,AdaWealth: Permissionless Fund Creation and Investment on Cardano,39725155,131053963,142,29955.6,NOT FUNDED,3.69
Fund10,Developer Ecosystem - The Evolu,Development of Cardano Index API,37802456,129229906,196,8200,NOT FUNDED,3.82
Fund10,Developer Ecosystem - The Evolu,Haskell Book Translation - The Way to Migrate Developers to Cardano From Other Chains,22525629,115161584,174,7200,NOT FUNDED,4.3
Fund10,Developer Ecosystem - The Evolu,"Fluxion - An Efficient, Flexible and Decentralized Custom Query Solution for Cardano",36582468,131059472,350,98461.2,NOT FUNDED,3.6
Fund10,Developer Ecosystem - The Evolu,ADAByte: Byte-sized Programming Tutorials,18374964,113312416,153,20000,NOT FUNDED,3.85
Fund10,Developer Ecosystem - The Evolu,Venture Capital deal flow: Connect investors with companies building on Cardano. Establish a deal flow process that will make it easier for investors to see the opportunities within the ecosystem.,29397402,124876513,146,28820,NOT FUNDED,4.2
Fund10,Developer Ecosystem - The Evolu,"Connecting Tech 2 Business. Promoting Cardano tech startups to business customers for sales, pilot or market feedback.",7884518,106466682,145,23540,NOT FUNDED,4.41
Fund10,Developer Ecosystem - The Evolu,[C2VN]: Cardano developer club in Universities,44493085,144178967,251,56813.2,NOT FUNDED,4.6
Fund10,Developer Ecosystem - The Evolu,"Fundraising support. Workshops, one on one sessions and a final pitch event for investors.",6150605,107954651,148,26180,NOT FUNDED,4.4
Fund10,Developer Ecosystem - The Evolu,ARTIFICIAL INTELLIGENCE Open Source ML/DApps,25735133,127775998,213,79399.6,NOT FUNDED,4.43
Fund10,Developer Ecosystem - The Evolu,Cardano For the Msses - Vietnamese Book for Vietnamese Devs,33884474,136443414,199,21863.6,NOT FUNDED,3.98
Fund10,Developer Ecosystem - The Evolu,DEMU Protocol | Phase 3 - Music Rights Management,47107736,149854584,362,264607.6,NOT FUNDED,4.09
Fund10,Developer Ecosystem - The Evolu,Sense - Smart contract Analyzer,20381150,123807247,146,30172.4,NOT FUNDED,4.21
Fund10,Developer Ecosystem - The Evolu,Add Fresh Engineering and Science Graduates to Developer Ecosystem,3757790,107490478,136,37600,NOT FUNDED,3.69
Fund10,Developer Ecosystem - The Evolu,"Cardano Developers Community in Kolkata, India",25091725,129683581,179,39360,NOT FUNDED,4.62
Fund10,Developer Ecosystem - The Evolu,Cardano Hackathon in Argentina II,24917346,130043817,190,40000,NOT FUNDED,4.1
Fund10,Developer Ecosystem - The Evolu,Unlocking Potential: Making Cardano the Go-To Choice for Developers.,8233507,113454597,155,37800,NOT FUNDED,4
Fund10,Developer Ecosystem - The Evolu,10 Marlowe templates - Marlowe has launched the mainnet. Now anyone can become a Cardano smart contracts developer,20298595,125537703,212,55750,NOT FUNDED,4.58
Fund10,Developer Ecosystem - The Evolu,"To address the scarcity of development tools and resources for Helios, a functional Domain-Specific Language (DSL) implemented in Javascript, my proposal is to enhance it by incorporating additional templates, examples, videos, docs and tests.",5589372,111101508,126,28200,NOT FUNDED,3.78
Fund10,Developer Ecosystem - The Evolu,MeetProposer-Bright Up Developer's Ideas,5932766,111878968,163,29270.4,NOT FUNDED,4
Fund10,Developer Ecosystem - The Evolu,9 Minutes to Million: Catalyst Project - Where Developer Dreams Flourish,3377540,109771774,138,43264.8,NOT FUNDED,3.67
Fund10,Developer Ecosystem - The Evolu,[C2VN]: Project Catalyst 360 events for Universities,12926681,120027474,202,21952,NOT FUNDED,4.54
Fund10,Developer Ecosystem - The Evolu,Incorporating Cardano blockchain into student scientific research projects,23815808,131345941,160,44506.8,NOT FUNDED,3.83
Fund10,Developer Ecosystem - The Evolu,Cardano-Africa French Community,19058393,126789510,148,38194,NOT FUNDED,4.27
Fund10,Developer Ecosystem - The Evolu,"Building bridges between Cardano, universities, and the private sector in Chile",21770218,129708969,208,40000,NOT FUNDED,4.36
Fund10,Developer Ecosystem - The Evolu,Mafoc: a composable chain indexer framework,5008765,113361709,137,76000,NOT FUNDED,2.73
Fund10,Developer Ecosystem - The Evolu,Developer Studio,11685138,120136582,152,34346.8,NOT FUNDED,4.54
Fund10,Developer Ecosystem - The Evolu,"Bring Cardano Blockchain Certified Associate, Gimbalabs Plutus Project-Based Learning(PPBL) and Catalyst School to developers",17506861,126525374,170,72960,NOT FUNDED,4.47
Fund10,Developer Ecosystem - The Evolu,Ethereum2Cardano On-Chain Developer Dictionary,18110240,127518172,198,60000,NOT FUNDED,3.96
Fund10,Developer Ecosystem - The Evolu,"Bespoke mentoring support programme for engaged Dev teams with a product, who are ready to secure the resources to 10x their business growth",2423536,114132738,135,19200,NOT FUNDED,3.78
Fund10,Developer Ecosystem - The Evolu,Oracle to connect electronic invoices systems for #RealFi use cases,12664465,124373786,150,60000,NOT FUNDED,4.29
Fund10,Developer Ecosystem - The Evolu,Open-source sign-in framework: Sign-in with wallet and/or CNFTs,9068380,121265743,152,22068.8,NOT FUNDED,4.4
Fund10,Developer Ecosystem - The Evolu,Cardano RealFi Consortium - Coordinator Role: Streamlining Synergies for Real World Blockchain Solutions,11119547,124381779,139,20000,NOT FUNDED,3.87
Fund10,Developer Ecosystem - The Evolu,Developers Reward program DEV$,12574818,126331435,135,58000,NOT FUNDED,3.22
Fund10,Developer Ecosystem - The Evolu,Stablecoin payments in Africa without an internet connection or a bank account - Kotani Pay integration,19521485,134101747,227,130400,NOT FUNDED,4.07
Fund10,Developer Ecosystem - The Evolu,web3.0 Recruitment application,13243591,127958252,139,28000,NOT FUNDED,2.27
Fund10,Developer Ecosystem - The Evolu,Adafro Labs Uganda - Cardano First principles Hackathon,17408786,132306243,140,27470,NOT FUNDED,2.6
