fund,category,proposal,yes,no,votes_cast,requested amount,status,overall_score
Fund10,Development & Infrastructure,Enable use-cases that require frequent message signing by introducing a safe standard for message signing without wallet prompts,677174268,127610526,980,71720,FUNDED,3.5
Fund10,Development & Infrastructure,Paima onchain game integration of Frontend Game Engines & Novel Technology,659098881,153964410,1206,288000,FUNDED,3.26
Fund10,Development & Infrastructure,Enable apps and games built in the Cardano ecosystem to leverage ZK cryptography for privacy and scalability,628854923,136872165,1140,180000,FUNDED,3.6
Fund10,Development & Infrastructure,Allow Cardano users to call Sidechain smart contracts directly from their Cardano mainnet wallet,630997644,146834778,1144,179310.4,FUNDED,3.4
Fund10,Development & Infrastructure,Allow using NFTs from Cardano and other ecosystem in onchain games hosted in the Cardano ecosystem,614957828,131763117,1069,260000,FUNDED,3.78
Fund10,Development & Infrastructure,Enable apps and games that require large amounts of data to function cheaply while still maximizing availability and safety,595749017,123556535,1045,108000,FUNDED,3.77
Fund10,Development & Infrastructure,MLabs - Congested Testnet,418680553,44875360,556,90856,FUNDED,4.47
Fund10,Development & Infrastructure,MLabs - Re-think CIP-30 wallet interface standard,407185399,60528849,607,108572,FUNDED,4.2
Fund10,Development & Infrastructure,Cardanoscan.io Maintenance,360149899,21269457,770,31200,FUNDED,3.94
Fund10,Development & Infrastructure,MLabs - CEMScript SDK: get your DApp implementation from annotated on-chain logic state-machine,381678774,43211879,558,116714.4,FUNDED,4.34
Fund10,Development & Infrastructure,MLabs - DeNS (Decentralized Name System): Phase I,371481768,46277286,680,103140,FUNDED,4.75
Fund10,Development & Infrastructure,Sundae Labs Hydra Transaction Stream Plugin,435236239,145866158,848,235200,FUNDED,4.07
Fund10,Development & Infrastructure,Decentralized Minting | ADA Handle,404968887,138421620,858,262000,FUNDED,4.32
Fund10,Development & Infrastructure,Blockfrost SDKs refresh,304194447,40812484,498,60000,FUNDED,3.72
Fund10,Development & Infrastructure,Cardano Based Web3 Blockchain Center in Tokushima-Yoshinogawa Japan,459466628,217494204,799,96000,FUNDED,3.5
Fund10,Development & Infrastructure,"Koios Evolution: Enhancements, Infra Support & Maintenance",337354190,106084582,653,160000,FUNDED,4.87
Fund10,Development & Infrastructure,Anastasia Labs - Streamlining Development: A User-Friendly Smart Contract Library for Plutarch and Aiken Design Patterns & Efficiency,267831491,51618841,525,100000,FUNDED,4.47
Fund10,Development & Infrastructure,Enable Eternl - F10,366712766,158051433,1015,221520,FUNDED,3.74
Fund10,Development & Infrastructure,Blockfrost bootstrap,272149187,71476525,548,14000,FUNDED,4.42
Fund10,Development & Infrastructure,CIP-88 Refinements & Tooling,223520345,27765942,449,30200,FUNDED,4.05
Fund10,Development & Infrastructure,Spectrum Network | Cross-chain Messaging Protocol,302093721,116353446,906,284224,FUNDED,4.88
Fund10,Development & Infrastructure,Erlang SDK for Blockfrost API,229982026,49711393,382,12000,FUNDED,3.73
Fund10,Development & Infrastructure,Sundae Labs Hydra Ledger-only Mode,336294417,156805226,827,235200,FUNDED,3.91
Fund10,Development & Infrastructure,Community CIP Editor: 1 year budget (continued),239810850,100076278,349,51546.4,FUNDED,4.33
Fund10,Development & Infrastructure,CardanoShield: Protecting Cardano Wallet Users,244289901,110382487,645,100000,FUNDED,4.74
Fund10,Development & Infrastructure,Simple Node Sharing on Cardano,231683934,110372333,618,14320,FUNDED,4.54
Fund10,Development & Infrastructure,A Zero Knowledge Proof framework for Cardano based on Hydra and ZK-SNARKS,162459336,45929137,489,30000,FUNDED,4.62
Fund10,Development & Infrastructure,Open Transaction Chaining tooling to speed up Cardano dApps - By MuesliSwap,228889843,116810788,579,17680,FUNDED,3.89
Fund10,Development & Infrastructure,Efficient atomic cross chain swaps between Cardano and other blockchains,247993171,146904160,715,72000,NOT FUNDED,4.58
Fund10,Development & Infrastructure,Cardano Advancement,152455363,56057380,380,28800,NOT FUNDED,3.4
Fund10,Development & Infrastructure,AdaStat Cardano Explorer for Pre-prod and Preview test networks,128451062,34231270,383,20000,NOT FUNDED,4.22
Fund10,Development & Infrastructure,Arweave Gateway API,209470389,117793086,556,64744,NOT FUNDED,3.85
Fund10,Development & Infrastructure,Typhon Wallet Mobile App,229205391,141855357,713,240000,NOT FUNDED,4.17
Fund10,Development & Infrastructure,Atlas 2.0 - PAB improvements and advanced features better leveraging UTxOs to build next-generation dApps,210163240,126364310,874,154666.4,NOT FUNDED,4.34
Fund10,Development & Infrastructure,"Marlowe Hub: Unifying Platform for Marlowe Smart Contracts, Oracles, and Mediators, Auditors and Developers",207555907,126692750,551,96000,NOT FUNDED,4.47
Fund10,Development & Infrastructure,Staking Baskets Platform - Incentivizing Cardano's Decentralization,149972922,75607472,402,138000,NOT FUNDED,3.87
Fund10,Development & Infrastructure,Cardano FUDS CIP & Implementation,138394604,65517149,422,44600,NOT FUNDED,3.73
Fund10,Development & Infrastructure,Open-Source Ledger Nano X Flutter SDK and VESPR Wallet Integration,186367922,119026643,586,108000,NOT FUNDED,4.7
Fund10,Development & Infrastructure,Staking Basket Ecosystem Contract + Audit - Incentivizing Cardano's Decentralization,139700114,75356493,413,120000,NOT FUNDED,4.43
Fund10,Development & Infrastructure,Open-Source database synchronization SDK,206889469,149043456,547,266000,NOT FUNDED,3.82
Fund10,Development & Infrastructure,Atrium Dashboard - The Heart of Cardano,128847019,82615931,421,89600,NOT FUNDED,3.4
Fund10,Development & Infrastructure,Xerberus Powered Catalyst Analytics Dashboard,171573003,127469801,713,80000,NOT FUNDED,4.13
Fund10,Development & Infrastructure,Terraform support for Blockfrost.io,172917078,132722154,410,48000,NOT FUNDED,3.85
Fund10,Development & Infrastructure,Incentivized On-chain Project Engagement platform,126365511,90654209,360,117600,NOT FUNDED,4.13
Fund10,Development & Infrastructure,NEWM Community - Onboard Android Devs to Cardano with PlutoK - Plutus Virtual Machine for Kotlin,160138503,129070375,569,123636.4,NOT FUNDED,4.38
Fund10,Development & Infrastructure,Naumachia: Rust Smart Contract Development Toolkit,81052704,51262422,380,19600,NOT FUNDED,4.4
Fund10,Development & Infrastructure,[C2VN]: Hydra Course for Non-Native English Community Developers,101108021,78309117,334,16744,NOT FUNDED,4.27
Fund10,Development & Infrastructure,cardano-node typescript implementation,175937685,159701435,669,555878.4,NOT FUNDED,4.3
Fund10,Development & Infrastructure,Invoicing SDK,66374009,53796106,288,20000,NOT FUNDED,2.71
Fund10,Development & Infrastructure,CBIA - Augmenting Cardano Developer Portal with ecosystem compatibility & dependency visualizations for dev tools,49780505,37512593,303,19100,NOT FUNDED,4.52
Fund10,Development & Infrastructure,Cardano Node API: a multiple protocol query interface,147041110,138940583,481,74000,NOT FUNDED,4.44
Fund10,Development & Infrastructure,Token Verification Alliance,153227152,145410745,492,193560,NOT FUNDED,4.17
Fund10,Development & Infrastructure,Maestro SDKs & ecosystem integrations - Enabling interoperability with scalable blockchain infrastructure,116608775,110423318,397,38133.2,NOT FUNDED,4.27
Fund10,Development & Infrastructure,Integrated Wallet Media Player: Enhancing Accessibility and Convenience,149595886,145807610,434,78800,NOT FUNDED,4.71
Fund10,Development & Infrastructure,NFT Staking Smart Contracts Audit,146764783,143200659,453,96400,NOT FUNDED,3.89
Fund10,Development & Infrastructure,gOuroboros: Cardano Ouroboros protocol server support in Golang,140617549,139225009,485,74000,NOT FUNDED,4.43
Fund10,Development & Infrastructure,Hydrozoa: Lightweight and scalable Hydra Heads,166956934,165786869,536,378190.4,NOT FUNDED,4
Fund10,Development & Infrastructure,Enhancing Access to Token and NFT Analytics: Proposal for Upgrading Wallet Analytics Functionality,140783058,140147518,381,85866.4,NOT FUNDED,4.31
Fund10,Development & Infrastructure,Open Source Sidechain Launcher Toolkit,121919188,125325076,352,99000,NOT FUNDED,4.1
Fund10,Development & Infrastructure,"Open Source Widget NoCode ""Keyword Coins Real Time Prices"" for Tokens on Cardano Ecosystem Embedded in Content for Websites, Portals & Blogs",94181221,100049087,338,97000,NOT FUNDED,3.96
Fund10,Development & Infrastructure,zkFold: zk-rollups on Cardano. Phase 1: zkWrapper,119470715,126136490,634,266000,NOT FUNDED,4.11
Fund10,Development & Infrastructure,"Catalyst Brasil: Driving innovation in the Cardano Community [Project Catalyst + Cardano Essentials in Sao Paulo, Brazil]",44988131,53618912,266,24900,NOT FUNDED,3.67
Fund10,Development & Infrastructure,KuberIDE 2.0: A complete IDE for Plutus Smart Contracts development,130428532,139064245,433,187316.8,NOT FUNDED,4.29
Fund10,Development & Infrastructure,Cardano Node on Microsoft Azure Marketplace,41286497,51259494,359,14000,NOT FUNDED,3.75
Fund10,Development & Infrastructure,Bridgeless Cross-Chain Swaps in 1 click for Cardano,55330049,65674433,386,16000,NOT FUNDED,4.56
Fund10,Development & Infrastructure,Open Multisig Synchronization Service,34428314,46840218,272,12000,NOT FUNDED,4.16
Fund10,Development & Infrastructure,Cardano Node on AWS - Quick Start,38758368,52618118,316,15800,NOT FUNDED,4.03
Fund10,Development & Infrastructure,Wolfram Cardano Exchange Data Infrastructure,141737895,156238977,552,329760,NOT FUNDED,3.93
Fund10,Development & Infrastructure,Learn and Earn Web3 Education Platform Powered by an AI co-pilot for course creators and learners,31125980,46456311,285,29800,NOT FUNDED,4.41
Fund10,Development & Infrastructure,Open Source NFT Display and Gallery,32928112,52253599,315,22068.8,NOT FUNDED,4.56
Fund10,Development & Infrastructure,"Open source Marketplace ""Opensea-like"" for MIlkomeda usecases and Seedstars Galaxy",124365353,144473079,344,116000,NOT FUNDED,3.28
Fund10,Development & Infrastructure,Unlocking Privacy on Cardano: Implementing an Anonymous Donation/Transaction System,28998338,49148680,270,22800,NOT FUNDED,3.75
Fund10,Development & Infrastructure,[CFD] - Cardano Fast Deployment tool. Setup and manage your infrastracture like a charm!,40693533,63757855,333,12000,NOT FUNDED,4.18
Fund10,Development & Infrastructure,CardanoPress Starter Themes and Templates,22413093,46858853,305,14000,NOT FUNDED,3.85
Fund10,Development & Infrastructure,Project Catalyst Funded Project PlayBook Revamp and Marketing/Community Project Support - SmartHubs,21299061,46382306,239,15600,NOT FUNDED,4.09
Fund10,Development & Infrastructure,Breaking Language Barriers: A Proposal for Expanding Global Accessibility through Comprehensive Language Support,129092932,154271582,382,59666.8,NOT FUNDED,4.51
Fund10,Development & Infrastructure,[Fimi] Cardano Podcast for Vietnamese,35851807,65613860,405,8990.4,NOT FUNDED,4.32
Fund10,Development & Infrastructure,"Integrate Cardano blockchain to PitchTalk - platform for communication between projects, investors, and communities",16986419,48515736,216,12000,NOT FUNDED,3.75
Fund10,Development & Infrastructure,From Argentina to the world. Building trust in the authenticity of academic documents with the power of Cardano: A systematic literature mapping,20344925,52062652,262,6000,NOT FUNDED,3.53
Fund10,Development & Infrastructure,Research Paper on Impact in Cardano,20275200,53815074,293,10000,NOT FUNDED,3.47
Fund10,Development & Infrastructure,"Teaching Turks Cardano Through Online Workshops, Youtube videos, and Community Building",23240244,57212669,256,6000,NOT FUNDED,3.63
Fund10,Development & Infrastructure,Cardano Users Onboarding Guide,32806309,67572854,304,27973.2,NOT FUNDED,4.24
Fund10,Development & Infrastructure,Blockchain Education Alpha Program for Vietnamese,33848781,69143897,261,19200,NOT FUNDED,3.79
Fund10,Development & Infrastructure,Open Source Snapshotter,28875899,65082383,245,24133.2,NOT FUNDED,3.95
Fund10,Development & Infrastructure,NEWM - Stream Token Analytics Integration,126761306,163986281,574,504000,NOT FUNDED,3.73
Fund10,Development & Infrastructure,Cardano Developer Training Program,36108608,73866018,326,24000,NOT FUNDED,3.06
Fund10,Development & Infrastructure,Db-Sync Enterprise: high-availability setup of Cardano's Db-Sync to run queries and access on-chain data as a service,22414782,61686301,256,9600,NOT FUNDED,2.84
Fund10,Development & Infrastructure,Blockchain 4 Good Research,25554879,65999122,266,18400,NOT FUNDED,4.19
Fund10,Development & Infrastructure,"NuNet: Enabling Elasticsearch Clusters on decentralized hardware // Elasticsearch is a fast and scalable search and analytics engine, providing powerful analytics and visualization tools. NuNet will enable running it on its decentralized network.",101210174,142773452,493,117440,NOT FUNDED,4.42
Fund10,Development & Infrastructure,[Fimi] Comprehensive information portal about Cardano for the Vietnamese community,28453031,72773280,362,14676,NOT FUNDED,4.4
Fund10,Development & Infrastructure,Promoting Cardano in Mainland China,39442213,84283151,350,16000,NOT FUNDED,2.13
Fund10,Development & Infrastructure,Cost-Effective Amazonian Solar-Powered Servers: Empowering Cardano Community as Global Blockchain Nodes,34022061,79068381,272,16000,NOT FUNDED,4.08
Fund10,Development & Infrastructure,NEWM Academy - Learn-to-Earn Education Platform,114309782,159469812,521,315151.6,NOT FUNDED,3.56
Fund10,Development & Infrastructure,Stellar Contracts: Open-source next-generation library for great contract architecture,64595622,115583776,361,44844.4,NOT FUNDED,4.67
Fund10,Development & Infrastructure,Passkeys as Read Only Wallets,19851980,71025197,247,20000,NOT FUNDED,3.89
Fund10,Development & Infrastructure,Buy or Sell $ADA On WhatsApp & Telegram by Automated ChatBot / On-Ramp and Off-Ramp Crypto Fiat/ADA ($BRL <-> $ADA),41771554,95384845,507,78428.4,NOT FUNDED,4.64
Fund10,Development & Infrastructure,Scalus - multiplatform Scala implementation of Cardano Plutus,61803765,116638145,334,116160,NOT FUNDED,3.96
Fund10,Development & Infrastructure,GameChanger: File Storage Protocol over Cardano - Enhancements and HTTP API Servers,90414046,148676289,453,103358.8,NOT FUNDED,4.37
Fund10,Development & Infrastructure,[Fimi] IOG's Research Paper for Vietnamese Developer,78190890,138848641,431,45088,NOT FUNDED,4.47
Fund10,Development & Infrastructure,Building a financial ecosystem through digital identity and stablecoin for maximal social impact,74186325,139850374,508,120000,NOT FUNDED,3.71
Fund10,Development & Infrastructure,Automated Smart Contract Auditing Tool,56963994,122713981,369,73840,NOT FUNDED,4.13
Fund10,Development & Infrastructure,Spot Converter: Buy Cardano NFTs with Any Crypto,69651489,136689006,407,30000,NOT FUNDED,4.22
Fund10,Development & Infrastructure,Texting through wallets,15335865,85025040,317,30000,NOT FUNDED,1.51
Fund10,Development & Infrastructure,Open Source Cardano API and Webhooks,64593239,134310169,412,86800,NOT FUNDED,4.67
Fund10,Development & Infrastructure,"Hardware-Secured Hot Wallets for Live Services (Dexes, Bridges, Side-Chains, Dapps, & more)",54777130,132132044,345,48254,NOT FUNDED,4.17
Fund10,Development & Infrastructure,Intergrate BitBox02 Hardware wallet into Cardano Wallets and Dapps,29444033,115304226,272,30000,NOT FUNDED,4
Fund10,Development & Infrastructure,Space Trains and Metadata: Scaling our Communities of Trust,66032846,152664851,260,43640,NOT FUNDED,4.09
Fund10,Development & Infrastructure,Templatized Cardano Node Hosted on Decentralized Compute Infrastructure,55516581,144593257,252,50000,NOT FUNDED,3.89
Fund10,Development & Infrastructure,Establishment of a Blockchain Research and Innovation Laboratory at KCG College of Technology,31147449,121606874,282,36000,NOT FUNDED,4.43
Fund10,Development & Infrastructure,Open source PRISM Node,58282425,148888362,357,164000,NOT FUNDED,4.23
Fund10,Development & Infrastructure,Enhanced Catalyst Proposals: Proposal Deposits and Bad Actor Penalties,58592695,149438649,281,44000,NOT FUNDED,3.18
Fund10,Development & Infrastructure,MineFreeUkraine: Coordination and DeFi Platform for Large-Scale Humanitarian Demining and Socio-Economic Recovery of Ukraine,67575045,159517791,336,144000,NOT FUNDED,3.59
Fund10,Development & Infrastructure,Babel Fees and Sponsored Transactions: NOW!,57008374,149128224,393,133378.4,NOT FUNDED,4.33
Fund10,Development & Infrastructure,Statur: Reputation Model for Web3 Ecosystem that encourages positive behaviour,56545853,149562173,494,107689.2,NOT FUNDED,4.2
Fund10,Development & Infrastructure,Cardano Research and Education Center with UTN and Government agreement,41776895,136823132,325,136000,NOT FUNDED,3.9
Fund10,Development & Infrastructure,Milkomeda Smart Contract Indexing,58953844,154206287,489,409498.4,NOT FUNDED,3.44
Fund10,Development & Infrastructure,Argus AI: Zero-Subscription SaaS Model For NFT Counterfeit Protection,24480903,120680013,256,33616,NOT FUNDED,4.33
Fund10,Development & Infrastructure,EON - Cross-chain Decentralized Data Feeds from Oracles,39951514,136629094,311,95932,NOT FUNDED,4.42
Fund10,Development & Infrastructure,Self sovereign identity (SSI) integration into crypto wallets,45591514,142652877,334,152000,NOT FUNDED,4.03
Fund10,Development & Infrastructure,BLOCKTRUST production-ready DIDComm Mediator,39148341,136630831,264,64000,NOT FUNDED,4.33
Fund10,Development & Infrastructure,Nanopublications Dashboard: a searchable natural language tool for atomic knowledge-sharing,36098048,136762096,300,33120,NOT FUNDED,4.67
Fund10,Development & Infrastructure,Upgrade CardanoSharp Library: Cross-Platform Compatibility & Optimized Coin Selection,38566532,142053140,293,76000,NOT FUNDED,3.44
Fund10,Development & Infrastructure,Post-quantum security for Cardano accounts ,49834268,153991469,371,80000,NOT FUNDED,3.23
Fund10,Development & Infrastructure,Open Sourced Licensing Agreement & Legal Standard for Cardano Digital Collectibles,41450535,146387312,282,120000,NOT FUNDED,3.86
Fund10,Development & Infrastructure,Ethereum2Cardano University,45444627,150773424,405,101600,NOT FUNDED,4.15
Fund10,Development & Infrastructure,Perun Virtual Channels as Payment Infrastructure,60353154,166663051,379,271400,NOT FUNDED,4.46
Fund10,Development & Infrastructure,Revolutionary NFT SDK (Software Development Kit) for Smart Contract (deno/js) that will finally make the Cardano NFT space decentralized and steepens the adoption curve for new businesses!,24037809,130932893,254,40000,NOT FUNDED,3.24
Fund10,Development & Infrastructure,DPAY - API PAYMENT GATEWAY,27222555,134699203,289,24000,NOT FUNDED,3.84
Fund10,Development & Infrastructure,Scarab - a cardano-node client implementation in functional Scala,54424664,163148698,344,200000,NOT FUNDED,4.35
Fund10,Development & Infrastructure,DCOne Crypto API for Open Source Developers,31954665,141996575,296,53066.4,NOT FUNDED,4.33
Fund10,Development & Infrastructure,Sisu Bridge Explorer: A Cross-Chain Bridge Explorer for ADA and EVM Chains to enable seamless Token Transfers,31719562,143163114,280,42000,NOT FUNDED,3.92
Fund10,Development & Infrastructure,Getting down to business! Building the Professional Decentralised Business Development Network,27117929,139070470,308,160800,NOT FUNDED,3.67
Fund10,Development & Infrastructure,SolarWise // Cardano Renewable Energy Oracle // Unleash the Power of Users and Communities powered by @energiasocial,28247834,141125979,304,30000,NOT FUNDED,4.08
Fund10,Development & Infrastructure,"Impact Web3 - The Ecosystem where Impact Measurement, Investing, and Verification collide and empower positive change through the Cardano Blockchain",27305721,140724997,269,84000,NOT FUNDED,3.92
Fund10,Development & Infrastructure,Cardano Staking API Development Proposal - Precise Insights and Analysis,35721851,149188200,320,40000,NOT FUNDED,4.39
Fund10,Development & Infrastructure,FluxusNetwork x Machinations,18507557,132398811,245,64000,NOT FUNDED,3.13
Fund10,Development & Infrastructure,The Beam Network: Decentralized Asset Protocol,28288842,143021471,277,112000,NOT FUNDED,4
Fund10,Development & Infrastructure,Cardano NFT Licenses,26665210,141988717,333,178997.2,NOT FUNDED,3.94
Fund10,Development & Infrastructure,A Dedicated NFT CIP Editor: Accelerating NFT Standards & Developer Success,31311273,147746777,274,78480,NOT FUNDED,3.58
Fund10,Development & Infrastructure,"Revolutionary pro-community NFT Smart Contract. Splitting service fee between multiple parties, on-chain affiliate, precision in lovelaces without any rounding up to the detriment of creators or users.",20138741,137270370,259,78400,NOT FUNDED,3.72
Fund10,Development & Infrastructure,All currencies exchange,19454296,138019432,310,6000,NOT FUNDED,1.08
Fund10,Development & Infrastructure,U.S. Legal Database and Compliance Assistant,29584264,148233026,338,88000,NOT FUNDED,4.27
Fund10,Development & Infrastructure,DRED decentralized API,27496655,147052671,272,154000,NOT FUNDED,3.83
Fund10,Development & Infrastructure,Complex Network Tools for Cardano: Funding a University Research Group,21906676,142121232,250,30000,NOT FUNDED,3.43
Fund10,Development & Infrastructure,FluxusNetwork x Scaleway,19700704,140341966,233,38000,NOT FUNDED,3.71
Fund10,Development & Infrastructure,PAAS - Smart Contract As a Service. A Quick and Low Cost Approach to Build dApps.,39588574,162177497,328,216000,NOT FUNDED,3.92
Fund10,Development & Infrastructure,[CNS] Cardano Name Service,24335379,148031495,354,84400,NOT FUNDED,3.5
Fund10,Development & Infrastructure,"Satellite Oracle: Cardano-based Measurement, Reporting and Verification (MRV) Platform for Environmental Protection and Restoration",32980588,157642367,336,144000,NOT FUNDED,4.47
Fund10,Development & Infrastructure,Callisto - Cardano Mobile SDKs for iOS & Android platforms,39755242,164761678,477,500000,NOT FUNDED,3.83
Fund10,Development & Infrastructure,Providing Equal Access to Technology and Web 3.0 Through Resources and Education,19771932,145209449,255,30000,NOT FUNDED,2.62
Fund10,Development & Infrastructure,To develop the means to introduce blockchain technology to the construction trades workforce. Using blockchain to create efficiencies in purchasing and scheduling.,20428057,147234219,259,30000,NOT FUNDED,1.92
Fund10,Development & Infrastructure,Optimizing Display Technologies,23551304,150808306,275,123613.6,NOT FUNDED,4
Fund10,Development & Infrastructure,The Goal Mechanism and Dynamics of Incentivized Compliance for Task and Goal Achievement,16502799,145200913,229,56645.2,NOT FUNDED,3.56
Fund10,Development & Infrastructure,Bridging Blockchain Worlds: Bitcoin Ordinals on Cardano for Enhanced Liquidity,28857681,157573410,330,40000,NOT FUNDED,3.67
Fund10,Development & Infrastructure,Standardizing Seamless Blockchain Integration for Unity Game Engine,35422095,164509275,438,276000,NOT FUNDED,4.11
Fund10,Development & Infrastructure,Writers' Safe on Cardano,19727944,153251314,268,41379.6,NOT FUNDED,3.67
Fund10,Development & Infrastructure,Cardano-Mendix plugin by the Landano team,26080367,160188842,292,199200,NOT FUNDED,3.59
Fund10,Development & Infrastructure,"(CaaS) Coin as a Service for SmartDev3: Copyright, coding, and web3 development tokenization",12765601,147591384,250,84000,NOT FUNDED,3.33
Fund10,Development & Infrastructure,Automated Rewards mechanisms for projects on Cardano,21143372,157239670,312,72000,NOT FUNDED,3.81
Fund10,Development & Infrastructure,GreenCycle // Cardano Smart Waste and Recycling Management Solution powered by @energiasocial,18524522,154684777,288,30000,NOT FUNDED,3.33
Fund10,Development & Infrastructure,Blockchain-Servitization Hub: Empowering African Startups,22006406,158500176,319,100000,NOT FUNDED,4.26
Fund10,Development & Infrastructure,Wallet Hunter: Leveraging Blockchain Data for Targeted Web3 Growth,14363319,152089581,252,40000,NOT FUNDED,3.78
Fund10,Development & Infrastructure,Servitization-Blockchain Accelerator: Revolutionizing Business Models,18740071,156515233,290,100000,NOT FUNDED,4
Fund10,Development & Infrastructure,Development of a Haskell-EDSL Optimized for Open-Source Hardware for Scalable Sidechains on the Cardano Blockchain,44474007,182938104,476,264000,NOT FUNDED,4.22
Fund10,Development & Infrastructure,"From Chaos to Clarity: Streamlining Legal and Infrastructure Challenges in the DAO Ecosystem. Research, Toolkit, Product ""On-Off-Chain Co"" & Education.",25496024,165197418,332,243200,NOT FUNDED,3.81
Fund10,Development & Infrastructure,FluxusNetwork European investment security for Cardano,22470277,163208585,294,152000,NOT FUNDED,3.67
Fund10,Development & Infrastructure,"Future Quest: the next-gen platform for X-prize style impact funding. We're a match-making incubator for high impact projects leveraging web3, community and science.",17340501,162232598,271,140000,NOT FUNDED,3.92
Fund10,Development & Infrastructure,FiDa - Obtain Class IIGB regulatory status in the Bermuda Monetary Authority.,13508671,158686155,267,90000,NOT FUNDED,2.67
Fund10,Development & Infrastructure,"ADAPIX - Buy & Sell ADA with R$ (Brazilian Reais), pay bills at millions of merchants and withdraw $ADA <-> Fiat on thousand of bank ATMs",28105848,173285048,434,159428.4,NOT FUNDED,3.38
Fund10,Development & Infrastructure,"Crypto Jobs, Blockchain Talents & Recruiting Platform With a Job Aggregator from Multiple Tech Sites and Sources",24092875,171740911,398,97714.4,NOT FUNDED,3.57
Fund10,Development & Infrastructure,"Rewards Without Borders: A Web2 Compatible, Cross-Chain Digital Collectibles Loyalty Program on Cardano",23832622,172446457,295,134800,NOT FUNDED,3.47
