fund,category,proposal,overall_score,votes_cast,yes,no,result,meets_approval_threshold,requested,status,reason_for_not_funded_status,challenge,unnamed:_6,unnamed:_4,unnamed:_2,fund_depletion,requested_$,unnamed:_1,unnamed:_3,reason_for_not_approved_status,requested_ada,abstain,unnamed:_5,fund_size:,approve
Fund10,Development & Infrastructure,Enable use-cases that require frequent message signing by introducing a safe standard for message signing without wallet prompts,,980,677174268,127610526,549563742,YES,,FUNDED,,,,,,8506300,,,,,179300,,,,
Fund10,Development & Infrastructure,Paima onchain game integration of Frontend Game Engines & Novel Technology,,1206,659098881,153964410,505134471,YES,,FUNDED,,,,,,7786300,,,,,720000,,,,
Fund10,Development & Infrastructure,Enable apps and games built in the Cardano ecosystem to leverage ZK cryptography for privacy and scalability,,1140,628854923,136872165,491982758,YES,,FUNDED,,,,,,7336300,,,,,450000,,,,
Fund10,Development & Infrastructure,Allow Cardano users to call Sidechain smart contracts directly from their Cardano mainnet wallet,,1144,630997644,146834778,484162866,YES,,FUNDED,,,,,,6888024,,,,,448276,,,,
Fund10,Development & Infrastructure,Allow using NFTs from Cardano and other ecosystem in onchain games hosted in the Cardano ecosystem,,1069,614957828,131763117,483194711,YES,,FUNDED,,,,,,6238024,,,,,650000,,,,
Fund10,Development & Infrastructure,Enable apps and games that require large amounts of data to function cheaply while still maximizing availability and safety,,1045,595749017,123556535,472192482,YES,,FUNDED,,,,,,5968024,,,,,270000,,,,
Fund10,Development & Infrastructure,MLabs - Congested Testnet,,556,418680553,44875360,373805193,YES,,FUNDED,,,,,,5740884,,,,,227140,,,,
Fund10,Development & Infrastructure,MLabs - Re-think CIP-30 wallet interface standard,,607,407185399,60528849,346656550,YES,,FUNDED,,,,,,5469454,,,,,271430,,,,
Fund10,Development & Infrastructure,Cardanoscan.io Maintenance,,770,360149899,21269457,338880442,YES,,FUNDED,,,,,,5391454,,,,,78000,,,,
Fund10,Development & Infrastructure,MLabs - CEMScript SDK: get your DApp implementation from annotated on-chain logic state-machine,,558,381678774,43211879,338466895,YES,,FUNDED,,,,,,5099668,,,,,291786,,,,
Fund10,Development & Infrastructure,MLabs - DeNS (Decentralized Name System): Phase I,,680,371481768,46277286,325204482,YES,,FUNDED,,,,,,4841818,,,,,257850,,,,
Fund10,Development & Infrastructure,Sundae Labs Hydra Transaction Stream Plugin,,848,435236239,145866158,289370081,YES,,FUNDED,,,,,,4253818,,,,,588000,,,,
Fund10,Development & Infrastructure,Decentralized Minting | ADA Handle,,858,404968887,138421620,266547267,YES,,FUNDED,,,,,,3598818,,,,,655000,,,,
Fund10,Development & Infrastructure,Blockfrost SDKs refresh,,498,304194447,40812484,263381963,YES,,FUNDED,,,,,,3448818,,,,,150000,,,,
Fund10,Development & Infrastructure,Cardano Based Web3 Blockchain Center in Tokushima-Yoshinogawa Japan,,799,459466628,217494204,241972424,YES,,FUNDED,,,,,,3208818,,,,,240000,,,,
Fund10,Development & Infrastructure,"Koios Evolution: Enhancements, Infra Support & Maintenance",,653,337354190,106084582,231269608,YES,,FUNDED,,,,,,2808818,,,,,400000,,,,
Fund10,Development & Infrastructure,Anastasia Labs - Streamlining Development: A User-Friendly Smart Contract Library for Plutarch and Aiken Design Patterns & Efficiency,,525,267831491,51618841,216212650,YES,,FUNDED,,,,,,2558818,,,,,250000,,,,
Fund10,Development & Infrastructure,Enable Eternl - F10,,1015,366712766,158051433,208661333,YES,,FUNDED,,,,,,2005018,,,,,553800,,,,
Fund10,Development & Infrastructure,Blockfrost bootstrap,,548,272149187,71476525,200672662,YES,,FUNDED,,,,,,1970018,,,,,35000,,,,
Fund10,Development & Infrastructure,CIP-88 Refinements & Tooling,,449,223520345,27765942,195754403,YES,,FUNDED,,,,,,1894518,,,,,75500,,,,
Fund10,Development & Infrastructure,Spectrum Network | Cross-chain Messaging Protocol,,906,302093721,116353446,185740275,YES,,FUNDED,,,,,,1183958,,,,,710560,,,,
Fund10,Development & Infrastructure,Erlang SDK for Blockfrost API,,382,229982026,49711393,180270633,YES,,FUNDED,,,,,,1153958,,,,,30000,,,,
Fund10,Development & Infrastructure,Sundae Labs Hydra Ledger-only Mode,,827,336294417,156805226,179489191,YES,,FUNDED,,,,,,565958,,,,,588000,,,,
Fund10,Development & Infrastructure,Community CIP Editor: 1 year budget (continued),,349,239810850,100076278,139734572,YES,,FUNDED,,,,,,437092,,,,,128866,,,,
Fund10,Development & Infrastructure,CardanoShield: Protecting Cardano Wallet Users,,645,244289901,110382487,133907414,YES,,FUNDED,,,,,,187092,,,,,250000,,,,
Fund10,Development & Infrastructure,Simple Node Sharing on Cardano,,618,231683934,110372333,121311601,YES,,FUNDED,,,,,,151292,,,,,35800,,,,
Fund10,Development & Infrastructure,A Zero Knowledge Proof framework for Cardano based on Hydra and ZK-SNARKS,,489,162459336,45929137,116530199,YES,,FUNDED,,,,,,76292,,,,,75000,,,,
Fund10,Development & Infrastructure,Open Transaction Chaining tooling to speed up Cardano dApps - By MuesliSwap,,579,228889843,116810788,112079055,YES,,FUNDED,,,,,,32092,,,,,44200,,,,
Fund10,Development & Infrastructure,Efficient atomic cross chain swaps between Cardano and other blockchains,,715,247993171,146904160,101089011,YES,,NOT FUNDED,Over Budget,,,,,32092,,,,,180000,,,,
Fund10,Development & Infrastructure,Cardano Advancement,,380,152455363,56057380,96397983,YES,,NOT FUNDED,Over Budget,,,,,32092,,,,,72000,,,,
Fund10,Development & Infrastructure,AdaStat Cardano Explorer for Pre-prod and Preview test networks,,383,128451062,34231270,94219792,YES,,NOT FUNDED,Over Budget,,,,,32092,,,,,50000,,,,
Fund10,Development & Infrastructure,Arweave Gateway API,,556,209470389,117793086,91677303,YES,,NOT FUNDED,Over Budget,,,,,32092,,,,,161860,,,,
Fund10,Development & Infrastructure,Typhon Wallet Mobile App,,713,229205391,141855357,87350034,YES,,NOT FUNDED,Over Budget,,,,,32092,,,,,600000,,,,
Fund10,Development & Infrastructure,Atlas 2.0 - PAB improvements and advanced features better leveraging UTxOs to build next-generation dApps,,874,210163240,126364310,83798930,YES,,NOT FUNDED,Over Budget,,,,,32092,,,,,386666,,,,
Fund10,Development & Infrastructure,"Marlowe Hub: Unifying Platform for Marlowe Smart Contracts, Oracles, and Mediators, Auditors and Developers",,551,207555907,126692750,80863157,YES,,NOT FUNDED,Over Budget,,,,,32092,,,,,240000,,,,
Fund10,Development & Infrastructure,Staking Baskets Platform - Incentivizing Cardano's Decentralization,,402,149972922,75607472,74365450,YES,,NOT FUNDED,Over Budget,,,,,32092,,,,,345000,,,,
Fund10,Development & Infrastructure,Cardano FUDS CIP & Implementation,,422,138394604,65517149,72877455,YES,,NOT FUNDED,Over Budget,,,,,32092,,,,,111500,,,,
Fund10,Development & Infrastructure,Open-Source Ledger Nano X Flutter SDK and VESPR Wallet Integration,,586,186367922,119026643,67341279,YES,,NOT FUNDED,Over Budget,,,,,32092,,,,,270000,,,,
Fund10,Development & Infrastructure,Staking Basket Ecosystem Contract + Audit - Incentivizing Cardano's Decentralization,,413,139700114,75356493,64343621,YES,,NOT FUNDED,Over Budget,,,,,32092,,,,,300000,,,,
Fund10,Development & Infrastructure,Open-Source database synchronization SDK,,547,206889469,149043456,57846013,YES,,NOT FUNDED,Over Budget,,,,,32092,,,,,665000,,,,
Fund10,Development & Infrastructure,Atrium Dashboard - The Heart of Cardano,,421,128847019,82615931,46231088,YES,,NOT FUNDED,Over Budget,,,,,32092,,,,,224000,,,,
Fund10,Development & Infrastructure,Xerberus Powered Catalyst Analytics Dashboard,,713,171573003,127469801,44103202,NO,,NOT FUNDED,Approval Threshold,,,,,32092,,,,,200000,,,,
Fund10,Development & Infrastructure,Terraform support for Blockfrost.io,,410,172917078,132722154,40194924,NO,,NOT FUNDED,Approval Threshold,,,,,32092,,,,,120000,,,,
Fund10,Development & Infrastructure,Incentivized On-chain Project Engagement platform,,360,126365511,90654209,35711302,YES,,NOT FUNDED,Over Budget,,,,,32092,,,,,294000,,,,
Fund10,Development & Infrastructure,NEWM Community - Onboard Android Devs to Cardano with PlutoK - Plutus Virtual Machine for Kotlin,,569,160138503,129070375,31068128,NO,,NOT FUNDED,Approval Threshold,,,,,32092,,,,,309091,,,,
Fund10,Development & Infrastructure,Naumachia: Rust Smart Contract Development Toolkit,,380,81052704,51262422,29790282,YES,,NOT FUNDED,Over Budget,,,,,32092,,,,,49000,,,,
Fund10,Development & Infrastructure,[C2VN]: Hydra Course for Non-Native English Community Developers,,334,101108021,78309117,22798904,NO,,NOT FUNDED,Approval Threshold,,,,,32092,,,,,41860,,,,
Fund10,Development & Infrastructure,cardano-node typescript implementation,,669,175937685,159701435,16236250,NO,,NOT FUNDED,Approval Threshold,,,,,32092,,,,,1389696,,,,
Fund10,Development & Infrastructure,Invoicing SDK,,288,66374009,53796106,12577903,NO,,NOT FUNDED,Approval Threshold,,,,,32092,,,,,50000,,,,
Fund10,Development & Infrastructure,CBIA - Augmenting Cardano Developer Portal with ecosystem compatibility & dependency visualizations for dev tools,,303,49780505,37512593,12267912,NO,,NOT FUNDED,Approval Threshold,,,,,32092,,,,,47750,,,,
Fund10,Development & Infrastructure,Cardano Node API: a multiple protocol query interface,,481,147041110,138940583,8100527,NO,,NOT FUNDED,Approval Threshold,,,,,32092,,,,,185000,,,,
Fund10,Development & Infrastructure,Token Verification Alliance,,492,153227152,145410745,7816407,NO,,NOT FUNDED,Approval Threshold,,,,,32092,,,,,483900,,,,
Fund10,Development & Infrastructure,Maestro SDKs & ecosystem integrations - Enabling interoperability with scalable blockchain infrastructure,,397,116608775,110423318,6185457,NO,,NOT FUNDED,Approval Threshold,,,,,32092,,,,,95333,,,,
Fund10,Development & Infrastructure,Integrated Wallet Media Player: Enhancing Accessibility and Convenience,,434,149595886,145807610,3788276,NO,,NOT FUNDED,Approval Threshold,,,,,32092,,,,,197000,,,,
Fund10,Development & Infrastructure,NFT Staking Smart Contracts Audit,,453,146764783,143200659,3564124,NO,,NOT FUNDED,Approval Threshold,,,,,32092,,,,,241000,,,,
Fund10,Development & Infrastructure,gOuroboros: Cardano Ouroboros protocol server support in Golang,,485,140617549,139225009,1392540,NO,,NOT FUNDED,Approval Threshold,,,,,32092,,,,,185000,,,,
Fund10,Development & Infrastructure,Hydrozoa: Lightweight and scalable Hydra Heads,,536,166956934,165786869,1170065,NO,,NOT FUNDED,Approval Threshold,,,,,32092,,,,,945476,,,,
Fund10,Development & Infrastructure,Enhancing Access to Token and NFT Analytics: Proposal for Upgrading Wallet Analytics Functionality,,381,140783058,140147518,635540,NO,,NOT FUNDED,Approval Threshold,,,,,32092,,,,,214666,,,,
Fund10,Development & Infrastructure,Open Source Sidechain Launcher Toolkit,,352,121919188,125325076,-3405888,NO,,NOT FUNDED,Approval Threshold,,,,,32092,,,,,247500,,,,
Fund10,Development & Infrastructure,"Open Source Widget NoCode ""Keyword Coins Real Time Prices"" for Tokens on Cardano Ecosystem Embedded in Content for Websites, Portals & Blogs",,338,94181221,100049087,-5867866,NO,,NOT FUNDED,Approval Threshold,,,,,32092,,,,,242500,,,,
Fund10,Development & Infrastructure,zkFold: zk-rollups on Cardano. Phase 1: zkWrapper,,634,119470715,126136490,-6665775,NO,,NOT FUNDED,Approval Threshold,,,,,32092,,,,,665000,,,,
Fund10,Development & Infrastructure,"Catalyst Brasil: Driving innovation in the Cardano Community [Project Catalyst + Cardano Essentials in Sao Paulo, Brazil]",,266,44988131,53618912,-8630781,NO,,NOT FUNDED,Approval Threshold,,,,,32092,,,,,62250,,,,
Fund10,Development & Infrastructure,KuberIDE 2.0: A complete IDE for Plutus Smart Contracts development,,433,130428532,139064245,-8635713,NO,,NOT FUNDED,Approval Threshold,,,,,32092,,,,,468292,,,,
Fund10,Development & Infrastructure,Cardano Node on Microsoft Azure Marketplace,,359,41286497,51259494,-9972997,NO,,NOT FUNDED,Approval Threshold,,,,,32092,,,,,35000,,,,
Fund10,Development & Infrastructure,Bridgeless Cross-Chain Swaps in 1 click for Cardano,,386,55330049,65674433,-10344384,NO,,NOT FUNDED,Approval Threshold,,,,,32092,,,,,40000,,,,
Fund10,Development & Infrastructure,Open Multisig Synchronization Service,,272,34428314,46840218,-12411904,NO,,NOT FUNDED,Approval Threshold,,,,,32092,,,,,30000,,,,
Fund10,Development & Infrastructure,Cardano Node on AWS - Quick Start,,316,38758368,52618118,-13859750,NO,,NOT FUNDED,Approval Threshold,,,,,32092,,,,,39500,,,,
Fund10,Development & Infrastructure,Wolfram Cardano Exchange Data Infrastructure,,552,141737895,156238977,-14501082,NO,,NOT FUNDED,Approval Threshold,,,,,32092,,,,,824400,,,,
Fund10,Development & Infrastructure,Learn and Earn Web3 Education Platform Powered by an AI co-pilot for course creators and learners,,285,31125980,46456311,-15330331,NO,,NOT FUNDED,Approval Threshold,,,,,32092,,,,,74500,,,,
Fund10,Development & Infrastructure,Open Source NFT Display and Gallery,,315,32928112,52253599,-19325487,NO,,NOT FUNDED,Approval Threshold,,,,,32092,,,,,55172,,,,
Fund10,Development & Infrastructure,"Open source Marketplace ""Opensea-like"" for MIlkomeda usecases and Seedstars Galaxy",,344,124365353,144473079,-20107726,NO,,NOT FUNDED,Approval Threshold,,,,,32092,,,,,290000,,,,
Fund10,Development & Infrastructure,Unlocking Privacy on Cardano: Implementing an Anonymous Donation/Transaction System,,270,28998338,49148680,-20150342,NO,,NOT FUNDED,Approval Threshold,,,,,32092,,,,,57000,,,,
Fund10,Development & Infrastructure,[CFD] - Cardano Fast Deployment tool. Setup and manage your infrastracture like a charm!,,333,40693533,63757855,-23064322,NO,,NOT FUNDED,Approval Threshold,,,,,32092,,,,,30000,,,,
Fund10,Development & Infrastructure,CardanoPress Starter Themes and Templates,,305,22413093,46858853,-24445760,NO,,NOT FUNDED,Approval Threshold,,,,,32092,,,,,35000,,,,
Fund10,Development & Infrastructure,Project Catalyst Funded Project PlayBook Revamp and Marketing/Community Project Support - SmartHubs,,239,21299061,46382306,-25083245,NO,,NOT FUNDED,Approval Threshold,,,,,32092,,,,,39000,,,,
Fund10,Development & Infrastructure,Breaking Language Barriers: A Proposal for Expanding Global Accessibility through Comprehensive Language Support,,382,129092932,154271582,-25178650,NO,,NOT FUNDED,Approval Threshold,,,,,32092,,,,,149167,,,,
Fund10,Development & Infrastructure,[Fimi] Cardano Podcast for Vietnamese,,405,35851807,65613860,-29762053,NO,,NOT FUNDED,Approval Threshold,,,,,32092,,,,,22476,,,,
Fund10,Development & Infrastructure,"Integrate Cardano blockchain to PitchTalk - platform for communication between projects, investors, and communities",,216,16986419,48515736,-31529317,NO,,NOT FUNDED,Approval Threshold,,,,,32092,,,,,30000,,,,
Fund10,Development & Infrastructure,From Argentina to the world. Building trust in the authenticity of academic documents with the power of Cardano: A systematic literature mapping,,262,20344925,52062652,-31717727,NO,,NOT FUNDED,Approval Threshold,,,,,32092,,,,,15000,,,,
Fund10,Development & Infrastructure,Research Paper on Impact in Cardano,,293,20275200,53815074,-33539874,NO,,NOT FUNDED,Approval Threshold,,,,,32092,,,,,25000,,,,
Fund10,Development & Infrastructure,"Teaching Turks Cardano Through Online Workshops, Youtube videos, and Community Building",,256,23240244,57212669,-33972425,NO,,NOT FUNDED,Approval Threshold,,,,,32092,,,,,15000,,,,
Fund10,Development & Infrastructure,Cardano Users Onboarding Guide,,304,32806309,67572854,-34766545,NO,,NOT FUNDED,Approval Threshold,,,,,32092,,,,,69933,,,,
Fund10,Development & Infrastructure,Blockchain Education Alpha Program for Vietnamese,,261,33848781,69143897,-35295116,NO,,NOT FUNDED,Approval Threshold,,,,,32092,,,,,48000,,,,
Fund10,Development & Infrastructure,Open Source Snapshotter,,245,28875899,65082383,-36206484,NO,,NOT FUNDED,Approval Threshold,,,,,32092,,,,,60333,,,,
Fund10,Development & Infrastructure,NEWM - Stream Token Analytics Integration,,574,126761306,163986281,-37224975,NO,,NOT FUNDED,Approval Threshold,,,,,32092,,,,,1260000,,,,
Fund10,Development & Infrastructure,Cardano Developer Training Program,,326,36108608,73866018,-37757410,NO,,NOT FUNDED,Approval Threshold,,,,,32092,,,,,60000,,,,
Fund10,Development & Infrastructure,Db-Sync Enterprise: high-availability setup of Cardano's Db-Sync to run queries and access on-chain data as a service,,256,22414782,61686301,-39271519,NO,,NOT FUNDED,Approval Threshold,,,,,32092,,,,,24000,,,,
Fund10,Development & Infrastructure,Blockchain 4 Good Research,,266,25554879,65999122,-40444243,NO,,NOT FUNDED,Approval Threshold,,,,,32092,,,,,46000,,,,
Fund10,Development & Infrastructure,"NuNet: Enabling Elasticsearch Clusters on decentralized hardware // Elasticsearch is a fast and scalable search and analytics engine, providing powerful analytics and visualization tools. NuNet will enable running it on its decentralized network.",,493,101210174,142773452,-41563278,NO,,NOT FUNDED,Approval Threshold,,,,,32092,,,,,293600,,,,
Fund10,Development & Infrastructure,[Fimi] Comprehensive information portal about Cardano for the Vietnamese community,,362,28453031,72773280,-44320249,NO,,NOT FUNDED,Approval Threshold,,,,,32092,,,,,36690,,,,
Fund10,Development & Infrastructure,Promoting Cardano in Mainland China,,350,39442213,84283151,-44840938,NO,,NOT FUNDED,Approval Threshold,,,,,32092,,,,,40000,,,,
Fund10,Development & Infrastructure,Cost-Effective Amazonian Solar-Powered Servers: Empowering Cardano Community as Global Blockchain Nodes,,272,34022061,79068381,-45046320,NO,,NOT FUNDED,Approval Threshold,,,,,32092,,,,,40000,,,,
Fund10,Development & Infrastructure,NEWM Academy - Learn-to-Earn Education Platform,,521,114309782,159469812,-45160030,NO,,NOT FUNDED,Approval Threshold,,,,,32092,,,,,787879,,,,
Fund10,Development & Infrastructure,Stellar Contracts: Open-source next-generation library for great contract architecture,,361,64595622,115583776,-50988154,NO,,NOT FUNDED,Approval Threshold,,,,,32092,,,,,112111,,,,
Fund10,Development & Infrastructure,Passkeys as Read Only Wallets,,247,19851980,71025197,-51173217,NO,,NOT FUNDED,Approval Threshold,,,,,32092,,,,,50000,,,,
Fund10,Development & Infrastructure,Buy or Sell $ADA On WhatsApp & Telegram by Automated ChatBot / On-Ramp and Off-Ramp Crypto Fiat/ADA ($BRL <-> $ADA),,507,41771554,95384845,-53613291,NO,,NOT FUNDED,Approval Threshold,,,,,32092,,,,,196071,,,,
Fund10,Development & Infrastructure,Scalus - multiplatform Scala implementation of Cardano Plutus,,334,61803765,116638145,-54834380,NO,,NOT FUNDED,Approval Threshold,,,,,32092,,,,,290400,,,,
Fund10,Development & Infrastructure,GameChanger: File Storage Protocol over Cardano - Enhancements and HTTP API Servers,,453,90414046,148676289,-58262243,NO,,NOT FUNDED,Approval Threshold,,,,,32092,,,,,258397,,,,
Fund10,Development & Infrastructure,[Fimi] IOG's Research Paper for Vietnamese Developer,,431,78190890,138848641,-60657751,NO,,NOT FUNDED,Approval Threshold,,,,,32092,,,,,112720,,,,
Fund10,Development & Infrastructure,Building a financial ecosystem through digital identity and stablecoin for maximal social impact,,508,74186325,139850374,-65664049,NO,,NOT FUNDED,Approval Threshold,,,,,32092,,,,,300000,,,,
Fund10,Development & Infrastructure,Automated Smart Contract Auditing Tool,,369,56963994,122713981,-65749987,NO,,NOT FUNDED,Approval Threshold,,,,,32092,,,,,184600,,,,
Fund10,Development & Infrastructure,Spot Converter: Buy Cardano NFTs with Any Crypto,,407,69651489,136689006,-67037517,NO,,NOT FUNDED,Approval Threshold,,,,,32092,,,,,75000,,,,
Fund10,Development & Infrastructure,Texting through wallets,,317,15335865,85025040,-69689175,NO,,NOT FUNDED,Approval Threshold,,,,,32092,,,,,75000,,,,
Fund10,Development & Infrastructure,Open Source Cardano API and Webhooks,,412,64593239,134310169,-69716930,NO,,NOT FUNDED,Approval Threshold,,,,,32092,,,,,217000,,,,
Fund10,Development & Infrastructure,"Hardware-Secured Hot Wallets for Live Services (Dexes, Bridges, Side-Chains, Dapps, & more)",,345,54777130,132132044,-77354914,NO,,NOT FUNDED,Approval Threshold,,,,,32092,,,,,120635,,,,
Fund10,Development & Infrastructure,Intergrate BitBox02 Hardware wallet into Cardano Wallets and Dapps,,272,29444033,115304226,-85860193,NO,,NOT FUNDED,Approval Threshold,,,,,32092,,,,,75000,,,,
Fund10,Development & Infrastructure,Space Trains and Metadata: Scaling our Communities of Trust,,260,66032846,152664851,-86632005,NO,,NOT FUNDED,Approval Threshold,,,,,32092,,,,,109100,,,,
Fund10,Development & Infrastructure,Templatized Cardano Node Hosted on Decentralized Compute Infrastructure,,252,55516581,144593257,-89076676,NO,,NOT FUNDED,Approval Threshold,,,,,32092,,,,,125000,,,,
Fund10,Development & Infrastructure,Establishment of a Blockchain Research and Innovation Laboratory at KCG College of Technology,,282,31147449,121606874,-90459425,NO,,NOT FUNDED,Approval Threshold,,,,,32092,,,,,90000,,,,
Fund10,Development & Infrastructure,Open source PRISM Node,,357,58282425,148888362,-90605937,NO,,NOT FUNDED,Approval Threshold,,,,,32092,,,,,410000,,,,
Fund10,Development & Infrastructure,Enhanced Catalyst Proposals: Proposal Deposits and Bad Actor Penalties,,281,58592695,149438649,-90845954,NO,,NOT FUNDED,Approval Threshold,,,,,32092,,,,,110000,,,,
Fund10,Development & Infrastructure,MineFreeUkraine: Coordination and DeFi Platform for Large-Scale Humanitarian Demining and Socio-Economic Recovery of Ukraine,,336,67575045,159517791,-91942746,NO,,NOT FUNDED,Approval Threshold,,,,,32092,,,,,360000,,,,
Fund10,Development & Infrastructure,Babel Fees and Sponsored Transactions: NOW!,,393,57008374,149128224,-92119850,NO,,NOT FUNDED,Approval Threshold,,,,,32092,,,,,333446,,,,
Fund10,Development & Infrastructure,Statur: Reputation Model for Web3 Ecosystem that encourages positive behaviour,,494,56545853,149562173,-93016320,NO,,NOT FUNDED,Approval Threshold,,,,,32092,,,,,269223,,,,
Fund10,Development & Infrastructure,Cardano Research and Education Center with UTN and Government agreement,,325,41776895,136823132,-95046237,NO,,NOT FUNDED,Approval Threshold,,,,,32092,,,,,340000,,,,
Fund10,Development & Infrastructure,Milkomeda Smart Contract Indexing,,489,58953844,154206287,-95252443,NO,,NOT FUNDED,Approval Threshold,,,,,32092,,,,,1023746,,,,
Fund10,Development & Infrastructure,Argus AI: Zero-Subscription SaaS Model For NFT Counterfeit Protection,,256,24480903,120680013,-96199110,NO,,NOT FUNDED,Approval Threshold,,,,,32092,,,,,84040,,,,
Fund10,Development & Infrastructure,EON - Cross-chain Decentralized Data Feeds from Oracles,,311,39951514,136629094,-96677580,NO,,NOT FUNDED,Approval Threshold,,,,,32092,,,,,239830,,,,
Fund10,Development & Infrastructure,Self sovereign identity (SSI) integration into crypto wallets,,334,45591514,142652877,-97061363,NO,,NOT FUNDED,Approval Threshold,,,,,32092,,,,,380000,,,,
Fund10,Development & Infrastructure,BLOCKTRUST production-ready DIDComm Mediator,,264,39148341,136630831,-97482490,NO,,NOT FUNDED,Approval Threshold,,,,,32092,,,,,160000,,,,
Fund10,Development & Infrastructure,Nanopublications Dashboard: a searchable natural language tool for atomic knowledge-sharing,,300,36098048,136762096,-100664048,NO,,NOT FUNDED,Approval Threshold,,,,,32092,,,,,82800,,,,
Fund10,Development & Infrastructure,Upgrade CardanoSharp Library: Cross-Platform Compatibility & Optimized Coin Selection,,293,38566532,142053140,-103486608,NO,,NOT FUNDED,Approval Threshold,,,,,32092,,,,,190000,,,,
Fund10,Development & Infrastructure,Post-quantum security for Cardano accounts ðŸ›¡,,371,49834268,153991469,-104157201,NO,,NOT FUNDED,Approval Threshold,,,,,32092,,,,,200000,,,,
Fund10,Development & Infrastructure,Open Sourced Licensing Agreement & Legal Standard for Cardano Digital Collectibles,,282,41450535,146387312,-104936777,NO,,NOT FUNDED,Approval Threshold,,,,,32092,,,,,300000,,,,
Fund10,Development & Infrastructure,Ethereum2Cardano University,,405,45444627,150773424,-105328797,NO,,NOT FUNDED,Approval Threshold,,,,,32092,,,,,254000,,,,
Fund10,Development & Infrastructure,Perun Virtual Channels as Payment Infrastructure,,379,60353154,166663051,-106309897,NO,,NOT FUNDED,Approval Threshold,,,,,32092,,,,,678500,,,,
Fund10,Development & Infrastructure,Revolutionary NFT SDK (Software Development Kit) for Smart Contract (deno/js) that will finally make the Cardano NFT space decentralized and steepens the adoption curve for new businesses!,,254,24037809,130932893,-106895084,NO,,NOT FUNDED,Approval Threshold,,,,,32092,,,,,100000,,,,
Fund10,Development & Infrastructure,DPAY - API PAYMENT GATEWAY,,289,27222555,134699203,-107476648,NO,,NOT FUNDED,Approval Threshold,,,,,32092,,,,,60000,,,,
Fund10,Development & Infrastructure,Scarab - a cardano-node client implementation in functional Scala,,344,54424664,163148698,-108724034,NO,,NOT FUNDED,Approval Threshold,,,,,32092,,,,,500000,,,,
Fund10,Development & Infrastructure,DCOne Crypto API for Open Source Developers,,296,31954665,141996575,-110041910,NO,,NOT FUNDED,Approval Threshold,,,,,32092,,,,,132666,,,,
Fund10,Development & Infrastructure,Sisu Bridge Explorer: A Cross-Chain Bridge Explorer for ADA and EVM Chains to enable seamless Token Transfers,,280,31719562,143163114,-111443552,NO,,NOT FUNDED,Approval Threshold,,,,,32092,,,,,105000,,,,
Fund10,Development & Infrastructure,Getting down to business! Building the Professional Decentralised Business Development Network,,308,27117929,139070470,-111952541,NO,,NOT FUNDED,Approval Threshold,,,,,32092,,,,,402000,,,,
Fund10,Development & Infrastructure,SolarWise // Cardano Renewable Energy Oracle // Unleash the Power of Users and Communities powered by @energiasocial,,304,28247834,141125979,-112878145,NO,,NOT FUNDED,Approval Threshold,,,,,32092,,,,,75000,,,,
